{
  "registry": { "repo": "lago-morph/ai-skills", "ref": "main" },
  "paths": {
    "skills":    ".codex/skills",
    "agents_md": ".codex/agents-md",
    "adrs":      ".codex/adrs"
  },
  "agents_md_output": {
    "agents_md": "AGENTS.md",
    "claude_md": "CLAUDE.md"
  },
  "subscriptions": {
    "skills":    [],
    "agents_md": [],
    "adrs":      []
  }
}
